Book Id,Title,Author,Author l-f,Additional Authors,ISBN,ISBN13,My Rating,Average Rating,Publisher,Binding,Number of Pages,Year Published,Original Publication Year,Date Read,Date Added,Bookshelves,Bookshelves with positions,Exclusive Shelf,My Review,Spoiler,Private Notes,Read Count,Owned Copies
50659467,"A Court of Thorns and Roses (A Court of Thorns and Roses, #1)",Sarah J. Maas,"Maas, Sarah J.",,"=""1635575567""","=""9781635575569""",4,4.20,Bloomsbury Publishing,Paperback,419,2020,2015,2023/08/31,2023/08/18,,,read,"IS THIS AN INTRODUCTION TO MAGICAL SMUT!?!?!?!?! IS THIS WHAT THE GIRLIES HAVE BEEN READIN????<br/><br/>I actually really enjoyed almost everything about this book. Reading about a magical world similar to the LOTR or the Percy Jackson series gave me so much childhood nostalgia and I was so invested in the description of the world and its characters. I'm giving it even more points for the fact that the Fae all look different and have various abilities.  That was one of my biggest gripes with the LOTR series. All the individuals within each race in LOTR don't have much of a difference between each of them. However, the Faeries have different abilities, look completely different from one another, and are characterized by distinct personalities. I think that is genuinely one of my favorite things about the book. <br/><br/>The introduction to Feyre was amazing. Badass girl fighting to keep her family alive, which gave me Katniss Everdeen vibes. She had such a dramatic character development throughout the book. Annoyance at her impoverished conditions, courage in protecting her family, fear when she was stolen from her home, depression as she is forced to adapt to a new lifestyle, love as she relishes in her surroundings, shame when she leaves her love to fight his battle alone, etc. I think by the end of the book, she is glad to be with Tamlin, but also feels utterly hopeless after committing such tragic acts to save the life of her lover and the rest of Prythian. I'm not gonna lie, I absolutely love that she falls into such a broken state. It's cool when characters are written into such heroic descriptions or have amazing endings by the end of the book. But to be able to vividly describe how a person becomes so mentally and physically exhausted is so difficult to do, and yet I find it so beautiful. Anyway, all this is to say that I see Feyre as an almost perfect character. <br/><br/>The rest of the characters are so well written as well and they all play a part in Feyre's journey. From the very beginning with her attack on Andras to her goodbye with Rhysand. I think my least favorite characters were probably Amarantha and the Attor, not because they're evil, but because they were so hyped up by Tamlin and Lucien to be overwhelmingly malevolent creatures. I don't think we really got to see how evil they really were. It's like if all wizards hyped up Voldemort, and then all we see in the movies is that he ruins the Ministry of Magic. We got a slight glimpse of Amarantha's ruthlessness as she pounded Feyre's body to the floor multiple times til she was bent like a pretzel, but like that was less than a chapter's worth ya know? I feel very torn on the fact that I like Rhysand. He's very methodical in his actions and thinks about the overall outcome, but the way he comes across as snarky and predatorial bothers me. At least he gave Feyre a sick tattoo. <br/><br/>Parts of the plot are so overbearingly predictable, that it makes me physically cringe sometimes as I read the book. Amarantha's whole riddle thing annoyed tf out of me. I read it and knew immediately that it was love, but it was dragged on for so long until Feyre was literally on the brink of death. Also, I'm getting a gut feeling that Feyre and Rhys end up together and I really do not like that at all. She is truly a victim of Stockholm Syndrome; both to Tamlin, and Rhys. But at least she had good times with Tamlin. I'm gonna be so sad if she does my boy dirty. <br/><br/>One last thing that I did not like is that they brought Feyre back as a High Fae. I'm guessing that it's all a foreshadowing moment since the girl named Feyre becomes a Faerie, but like that takes so much out of her character. Feyre was strong because despite being a human, she fended off multiple faeries, held her chin high against the literal evil queen of faeries in Prythian, and did not see her lack of magic as a major flaw in herself. Now that she has all these abilities and strengths, it kind of weakens her character for me. Obviously, you have to keep the main character alive, but I think it would've been even better if Tamlin exchanged his immortality to keep Feyre alive. Tamlin would still be powerful and live for a long time, just not eternity. <br/><br/>Overall, I'm very glad I read this book and can't wait to read the rest of the magical smut series! I do agree that the book can be slow at times, but if it builds the world to be so scenic and diverse, then I'm all for it.<br/><br/>Guys, I learned a new word!<br/><br/><u>flummoxed</u><br/><i>/ˈfləməkst/</i><br/><b>adjective</b><br/> bewildered or perplexed.<br/><br/>Overall Score: 4.4/5",,,1,0
56755560,The Cat Who Saved Books,Sōsuke Natsukawa,"Natsukawa, Sōsuke",Louise Heal Kawai,"=""0063095726""","=""9780063095724""",3,3.72,HarperVia,Hardcover,198,2021,2017,2023/08/16,2023/03/16,,,read,"Overall, a really endearing story about a boy going overcoming grief due to the recent passing of his grandfather. <br/><br/>Rintaro’s grandfather owns Natsumi Books, which is like the equivalent of a thrift store for books where you can find vintage stories and rare tales. Since Rintaro’s parents passed away when he was young, he’s been staying with grandfather for quite some time. He’s pretty reclusive, so he tends to skip school and just read at the shop. After his grandfathers funeral, his lovely aunt tells him that he could stay with her, which agreed upon. Realizing that since his grandfathers is now gone, the shop would have to close. He stays there a bit longer and keeps the shop open, following the same daily rituals his grandfather did. He doesn’t talk to many people, but a couple of particular classmates come by on random occasions; one of them being his class rep, Sayo. Sayo always bugs Rintaro to come back to school and he doesn’t seem why she cares so much since he’s moving soon anyways. One afternoon, an orange cat appears before him and tells him that some books need to be saved. With a minimal amount of convincing, the cat wins and Rintaro joins the cat for an adventure. <br/><br/>That’s pretty much how the story gets started and the duo go on 4 magical journeys to save books (Sayo ends up joining the adventures as well). As the story continues, you see Rintaro, who was once a sorrowful and reclusive boy, become confident and independent. He manages to gain courage and become a better person with the help of Sayo and of course the orange cat. <br/><br/>Each adventure wasn’t the most thrilling, but I thought it was really wholesome and honestly made me appreciate books more. I thoroughly enjoyed all the characters in this book; they were just all so likable and were necessary for the progression of the story. The only qualm I had with the book is that the cat isn’t as active in the saving of books as the title suggests. The title should be more like “The Cat Who Guides a Teenage Boy to a Magical Realm to Save Books”; but still, he’s a cool cat. <br/><br/>I feel like this would be a great bed time story for kids. <br/><br/>Overall Score: 3.6/5.0",,,1,0
57693639,Pure Colour,Sheila Heti,"Heti, Sheila",,"=""0374603944""","=""9780374603946""",3,3.48,"Farrar, Straus and Giroux",Hardcover,224,2022,2022,2023/07/11,2023/04/29,,,read,"I honestly think I'm just too dumb to understand the full context of this story. <br/><br/>It was definitely beautiful, but in a way that just leaves you dumbfounded and in awe that something so abnormal exists. Like if you've ever been to an art museum and seen an art piece that makes you wonder how tf it qualifies as art, but the more you look at it, it makes sense even though you still don't understand why. That's what this book was like. I kept reading and reading, absorbing some information here and there, but I never got the full context of the book; possibly because I read too literally and this whole novel is a metaphorical universe. <br/><br/>***This part is a bit of a spoiler, cuz idk how else to explain the book***<br/><br/>For some context, the story follows Mira, an art critic. Mira lives her life at college and meets a woman named Annie - who she eventually falls for. Although enjoying her college life, she feels guilty for being away from her father and not being able to spend time with him. As time goes on, Mira's father's health deteriorates and he eventually passes away with Mira at his bedside. At that moment, his spirit does some crazy things and now his spirit kinda lives within Mira. She faces the stages of grief and tries to mend her wounded soul by taking a trip into nature. She becomes a leaf with her father. Idk how, but somehow she becomes a leaf and she seems to enjoy it. So much so that she does not want to ever go back to being a human. Mira and her father have conversations as they are in leaf form. Mira seeing that this is an option for the afterlife is convinced it's not so bad. Her father attempts to prove to her that it is not her time and that there is so much more she is to experience in her human life. Mira is semi-convinced, but even if she wanted to go back to human form, she doesn't know how. That's when Annie joins the story again and pulls Mira out of the leaf. Annie helps get Mira back on her feet and eventually leaves again. Mira, still in love with Annie, is still struggling to understand their relationship and how she fits in a world without her father. She goes to Annie to confess her love but fails to get the words out. <br/><br/>Okay, that's as much as I'll explain because I wasn't really satisfied with the ending of the story, but I guess it's kind of happy for Mira. <br/><br/>***End of spoilers***<br/><br/>The writing of the story itself was genuinely so creative; although, sometimes the way Miss Heti articulated some metaphors had me like ",,,1,0
62805,The Sound of Waves,Yukio Mishima,"Mishima, Yukio",,"=""0099289989""","=""9780099289982""",3,3.78,Vintage Classics,Paperback,183,2000,1954,2023/06/26,2023/05/16,,,read,"A very cute and endearing love story between two young teenagers, muddled with the repetitive taboos of forbidden love. <br/><br/>Shinji, a young fisherman, was honestly a pretty chill character. Didn't do anything too wild, focused on what mattered most to him, and was oblivious to the other's perception of him because he just didn't really care. Hatsue, the daughter of the wealthiest islander, was overall a jovial character that exuded that pureness of youth. I don't read too many romantic stories, but even I thought they were such a cute couple and they had moments that made me smile like a middle school boy who just hugged his crush. Shinji had all the odds stacked against him, since he comes from a broken family, was not wealthy, and the island was very conservative when it came to dating. However, Shinji was still a respectable young boy among his peers and on the island. He knew the only way to win over Hatsue's father was to earn his respect. <br/><br/>I really liked Hatsue cuz she was never a ""damsel in distress"" type of character. In most situations, she made the first move; even when she was forbidden to see Shinji by her father, she still attempted to see him as much as possible. She was very independent and was fighting her own battle for love while apart from Shinji. While Shinji attempts to gain the respect of Hatsue's father, Hatsue is doing everything she can to earn the respect of Shinji's mother. <br/><br/>At the climax, Shinji completes a difficult task that earns the respect of many fishermen, the islanders, and Hatsue's father. Hatsue also gains the respect of Shinji's mother by winning a competition and offering a gift to his mother. In the end, their wishes are fulfilled, and live happily ever after. <br/><br/>I'm honestly quite shocked that this is the same author that wrote <i>Life For Sale</i>. That book had the wildest scenarios and you could never guess what was happening next. <i>The Sound of Waves</i> was really tame, and I don't think I'm really a fan of that cuz it took me forever to finish this book even though I enjoyed it. I WANT DRAMA. SOMETHING TO STIR THE POT AND CREATE PROBLEMS TO KEEP ME ENGAGED. Maybe I'm toxic for that, but oh well :)<br/><br/>Overall Score: 3.7/5<br/><br/><br/><br/><br/><br/>Sidenote: <br/>I am Icarus and my 50-book reading goal is the sun ",,,1,0
56852407,Billy Summers,Stephen King,"King, Stephen",,"=""1982173610""","=""9781982173616""",0,4.21,Scribner,Hardcover,515,2021,2021,,2023/05/19,to-read,to-read (#4),to-read,,,,0,0
48890205,Tokyo Ueno Station,Yū Miri,"Miri, Yū",Morgan Giles,"=""0593088026""","=""9780593088029""",2,3.49,Riverhead Books,Hardcover,180,2020,2014,2023/01/08,2022/10/03,,,read,"This was genuinely such a difficult read for me. I'm the type of person who needs to finish a book before starting a new one. I had such little motivation to read this book; quite literally not touched the book for over 2 months.<br/><br/>The premise of the story isn't that bad. I just think the story dragged on for so long that I began to hate how pitiful the main character is.<br/><br/>This is my spoiler-free summary of the book: <br/>""Unlucky man goes through a series of unfortunate events leading to the demise of his unsuccessful life - becoming a cursed spirit that is forced to watch even more unfavorable circumstances.""<br/><br/>If you want to direct your frustration toward a pathetic main character, then this is definitely the story to read. <br/><br/>Overall Score: 2.0/5",,,1,0
43969886,Salvation Lost (The Salvation Sequence),Peter F. Hamilton,"Hamilton, Peter F.",,"=""0399178856""","=""9780399178856""",3,4.30,Del Rey,Hardcover,512,2019,2019,,2022/10/03,,,read,"Honestly, I felt kind of lost as I read Salvation Lost. <br/><br/>I did not realize that this book was the second of a series called Salvation; a total misunderstanding on my part. <br/><br/>Nonetheless, still a good read, and will definitely re-read it in the future once I read its predecessor. <br/><br/>Overall Score: 3.0/5",,,1,0
59147138,The Novelist,Jordan Castro,"Castro, Jordan",,"=""1593767137""","=""9781593767136""",3,3.48,Soft Skull,Hardcover,196,2022,2022,2023/04/10,2023/02/05,,,read,"I think this is the most impartial I've felt toward a book. <br/><br/>The story is about an author that is procrastinating on writing his novel. The whole story takes place in just one morning; mainly in his own home. He goes on his laptop to start typing, gets distracted by Twitter, then Insta, then back to his Word document for a moment, ultimately returning back to the Twitter tab for the third time in less than a span of 10 seconds. Those parts of the story gave me genuine anxiety, which is why I feel like the book can be somewhat relatable. As the story goes on, it doesn't get better for the author. Really the whole book is a sequence of actions that allow him to keep procrastinating for the full morning.<br/><br/>I didn't really find the story entertaining, but I was definitely impressed by the talent of an author to be able to write 196 pages about literally nothing.<br/><br/>Would I recommend the book? Probably not. But I do have high respect for Jordan Castro and English/Journalism majors that are able to write like this.<br/><br/>Overall Score: 3.0/5",,,1,0
11297,Norwegian Wood,Haruki Murakami,"Murakami, Haruki",Jay Rubin,"=""0375704027""","=""9780375704024""",4,4.02,Vintage Books,Paperback,296,2000,1987,2023/01/27,2023/01/18,,,read,"I wanted to read some work by Murakami because I heard it's challenging to get through at times. So I picked up the novel that pushed him to stardom in Japan. <br/><br/>The critique of Murakami was definitely correct. 5 pages of Reiko's backstory was enough to make me feel uncomfortable for two days. <br/><br/>Other than that section of the novel, I thoroughly enjoyed the rest. Every character serves a purpose in Toru's life. Mostly because he doesn't go out of his way to make friends, but when he does, they serve an important role. All of these characters were likable in their own way and each have their own flaws of course. Even an asshole like Nagasawa can have shining traits to him at times. <br/><br/>What was interesting to me was that the pace of the plot never seemed to revolve around Toru, the main character. Naoko's well-being seemed to hold a precedent over his life and would direct nearly all his actions. I found this to be sweet, but at the same time so discouraging since we know it would never work out between them from the first chapter. <br/><br/>I really like Toru as a character. I saw a bunch of reviews detailing how pitiful he was, which I find so compassionless. He had gone through so much starting at 17 years old, and the pain never really left him. Haunted by loss and love, he truly did the best that he could do at all times. He never really moped around or felt entitled to anything. He worked hard for his money, his education, and himself; albeit, even if it was just to keep himself busy. Of course, he had his ups and downs, but what kind of human wouldn't? <br/><br/>There's a lot of suicide in this story. The death of some of these characters left me feeling so demoralized. The first sentence of chapter 11 tore my heart out of my chest and had me yelling into my pillow that life was so unfair. However, the ending was somewhat wholesome even if the book did leave me feeling numb til I fell asleep. I truly wish the best for everyone, but novels such as this remind me that some people just do not get that opportunity in life. <br/><br/>Loved the rollercoaster of emotions this story took me through. Will be reading another work by Murakami soon :) <br/><br/>Overall Score: 4.5/5",,,1,0
61340205,The Flowers of Buffoonery,Osamu Dazai,"Dazai, Osamu",Sam Bett,"=""0811234541""","=""9780811234542""",3,3.90,New Directions,Paperback,96,2023,1935,2023/05/05,2023/05/03,,,read,"JUST BOYS BEING BOYS; especially after one of the homies attempted a lover's suicide and survived.<br/><br/>I didn't even know one of my favorite novels had a prequel. So when I randomly picked this book up in a cute bookshop in DC, I was so excited. Although, Dazai wrote <i>No Longer Human</i> years later, the characteristics of Yozo fit so well and it didn't feel abnormal to read about Yozo again. <br/><br/>The story itself is not particularly exciting; I mean the story revolves around Yozo being in the hospital for less than a week, so not much happens. But the vibe of the book was just really warming, even though Yozo just went through such a tragic event. Basically, Yozo's friends come to console him while he's in the hospital, and they have a great time together while also tiptoeing around the dark atmosphere of Yozo's depression and suicide attempt. It's just nice to read about someone having such great companions in their life. <br/><br/>Dazai just randomly interjects his thoughts, opinions, and rants throughout the novel. A character could be in the middle of dialogue and then he'll randomly input his hatred for the character that he is literally writing about. <br/><br/>My favorite line from the book is: <br/><br/><blockquote><br/>""White smoke from the volcano on Oshima, just above the horizon, drifted up into the sky. <br/>Nevermind. I hate describing scenery"" <br/></blockquote><br/><br/>That's literally the hardest line from all his novels. Bro was ahead of his time. I know that's pretentious to say now, but what other author in the 1930s is breaking the fourth wall like that? <br/><br/>Anyways, the content of the book was lackluster but the vibes were up, making it very enjoyable - plus it was a quick read. <br/><br/>Overall Score: 3.9/5",,,1,0
43685241,Life for Sale,Yukio Mishima,"Mishima, Yukio",,"=""0241333148""","=""9780241333143""",4,3.73,Penguin Classics,Paperback,192,2019,1968,2023/02/07,2023/02/05,,,read,"Brilliantly absurd. <br/>The most bizarre introduction to a book I have ever read and it just kept getting crazier!<br/><br/>I had so much fun reading this book because it was just insane. Like you quite literally have to be on something to write a story like this, but I think that's part of the reason I loved this book. Every arc felt so random. If you tried to guess what would happen next, you'd probably be wrong 99% of the time. <br/><br/>Hanio is a dude that just attempted suicide on a whim and failed. Since he just failed death, he no longer has many emotions towards societal standards, good vs. evil, or even his own well-being. He becomes the embodiment of ""go with the flow"". So he quits his job, puts an ad in the newspaper saying ""Life For Sale"", and just waits at his apartment. From then on he gets involved with shady customers that get him into situations that are less than favorable. Even though these situations are dark and shocking to most, he still just goes through with it. It's just so insane to me that it becomes funny. <br/><br/>Every page you turn you say ""how could this possibly get worse"" and then it absolutely gets worse. You're basically just sitting like :0 the whole time you read this book. That's why I loved it. The unpredictable situations this average dude gets into are like opening Pandora's box, but the way Yukio Mishima writes the story is just so seamless and entertaining. <br/><br/>Very confused about how this book is not like the top 50 of Japanese modern literature.<br/><br/>THE ENDING IS SUCH A CLIFFHANGER. I WISH THIS STORY HAD A SEQUEL >:I <br/><br/>Overall Score: 4.9/5",,,1,0
40611182,Star,Yukio Mishima,"Mishima, Yukio",Sam Bett,"=""0811228428""","=""9780811228428""",0,3.63,New Directions,Paperback,96,2019,1961,,2023/05/03,to-read,to-read (#3),to-read,,,,0,0
57899793,All My Rage,Sabaa Tahir,"Tahir, Sabaa",,"=""0593202341""","=""9780593202340""",0,4.52,Razorbill,Hardcover,376,2022,2022,,2023/05/03,to-read,to-read (#2),to-read,,,,0,0
11991,The Fall,Albert Camus,"Camus, Albert",Justin O'Brien,"=""0679720227""","=""9780679720225""",3,4.04,Vintage Books,Paperback,147,1991,1956,2023/04/25,2023/04/14,,,read,"Bro is the most delusional, narcissistic, self-centered, pathological coward I have ever read about. But that's what makes the book interesting. <br/><br/>I don't know how to label the narration of this book. It's like a third person since the actual narrator never says a single word. The main character Jean-Baptiste Clamence kind of steals the whole narration, and describes the facial expressions or even skips over the whole dialogue with the narrator. So is it really third person, or is it second person and Jean is just narrating his story to a random person??? idk, but it is really hard for me to wrap my head around it for some reason. <br/><br/>Anyways, the story starts when Jean starts talking to the narrator in an Amsterdam bar. He's really respectful and social; which just comes off as odd. He hypes himself up and starts describing his life as a lawyer and how he was so good to those in need. As I described in my first sentence, he is all of those traits. So you can't really take his word for it, but you just go along with it at first. He admits at the end of the first encounter, that it is not out of the goodness of his heart that he treats everyone with respect; he does it to keep up an outstanding reputation. The story follows him over 5 days. After every encounter with him, you peel back a layer of his personality and realize that he is the scum of the earth (by social standards of course). It's quite literally a verbal ""Fall from grace"". Although you can't believe 100% of what he says, I do find it respectable that he is honest about his flaws. <br/><br/>I do think this was a pretty average read in terms of how engaged I felt throughout reading it, but the concept and the perspective of narration intrigue me. <br/><br/>Overall Score: 3.5/5",,,1,0
