Book Id,Title,Author,Author l-f,Additional Authors,ISBN,ISBN13,My Rating,Average Rating,Publisher,Binding,Number of Pages,Year Published,Original Publication Year,Date Read,Date Added,Bookshelves,Bookshelves with positions,Exclusive Shelf,My Review,Spoiler,Private Notes,Read Count,Owned Copies
44421460,"Before the Coffee Gets Cold (Before the Coffee Gets Cold, #1)",Toshikazu Kawaguchi,"Kawaguchi, Toshikazu",Geoffrey Trousselot,"=""1529029589""","=""9781529029581""",1,3.71,Picador,Paperback,213,2019,2015,2023/03/15,2023/02/19,,,read,"I love the concept of time travel and my literal dream is to open a coffee shop once I retire, so you would think I would love this book. Unfortunately, I found it dull and very, VERY, slow. <br/><br/>The story is comprised of 4 different situations of certain people traveling back in time in the cafe.  The majority of these characters are reoccurring in all 4 scenarios. The basic idea of this version of time travel is that a person can travel back in time while sitting in the seat of a specific cafe. Once you are in the past, you cannot move from your seat and you must finish your coffee before it gets cold. The actions you make while in the past, do not affect the present at all. <br/><br/>MY BIGGEST PROBLEM WITH THIS BOOK IS THAT NOTHING HAPPENS. <br/><br/>Because no actions you make in the past affect the present, the story seems to have no driving plot. <br/>It kind of takes away the mysteries of time travel. The butterfly effect is completely taken off the table, the idea of multiple timelines is basically destroyed, and one can argue that there is no reason to visit the past since nothing actually changes. <br/><br/>The characters that time traveled really only get closure or at least something to think about from their visits to the past. But like 3 out of the 4 characters could have just gotten a therapist. Like why even travel into the past anyways???<br/><br/>I only really enjoyed the second story since it felt more unique and heartwarming. It's about a husband with dementia and a wife that has seen it coming for a long time but has to come to terms with it. I feel like you could read just the second story and feel fulfilled by the book. The other stories just seem so typical. <br/><br/>I think I'm just really mad it took me so long to read this book because I was so bored. Maybe the sequels to this book are better, but I don't think I'll be giving them a chance anytime soon. <br/><br/>Overall Score: 1.5/5",,,1,0
4929,Kafka on the Shore,Haruki Murakami,"Murakami, Haruki",Philip Gabriel,"=""1400079276""","=""9781400079278""",3,4.13,Vintage International,Paperback,467,2006,2002,2023/02/17,2023/01/08,,,read,"My oh my, does Murakami have such a way with words - but specifically to make you uncomfortable. <br/><br/>The only other Murakami novel I've read is <i>Norwegian Wood</i>, and it's safe to say this book is in a totally different realm. Oddly enough I feel like <i>Kafka on the Shore</i> was a darker, twisted, fantasy version of <i>Norwegian Wood</i>. Both novels are entwined in realism, but this book is a little more magical. <br/><br/>The story revolves around a 15-year-old boy who names himself Kafka. He leaves home because his dad isn't the best and curses him with an Oedipus-like prophecy. At the same time, the story also revolves around a 60-year-old man called Nakata who lost the ability to read, write and comprehend things after a bizarre accident when he was young during the war. Their stories alternate throughout the book and, at first, seem to have no relevance to each other. Eventually, their paths cross - but not really - causing both of them to be on the run from the police and fix their lives. <br/><br/>Sound normal? Well, it really isn't at all. <br/>The novel is written with magical realism; so, while most of the story seems like the ordinary everyday lives of these two individuals, there are also random elements of fantasy written sprinkled around the book. When we meet Nakata, he's able to talk to cats. He doesn't know why he's able to talk to cats, just that after the mysterious accident he gained that ability. Eventually, he gains other mystical abilities on a quest to flip over a stone that will close the portal to another realm. Kafka, while on the run from the police, gains the ability to see a ghost. That he falls in love with. That also happens to be the ghost of a living 50-year-old librarian name Miss Saeki whom he kind of works for. That also may or may not be his mother...<br/><br/>Honestly, the novel ends up feeling like a fever dream as you continually read it. There were points in the book where it just felt like the most random things were happening and you just gotta keep reading to see what happens. At one point I think Murakami himself shows up in the middle of the novel in the form of Colonel Sanders - literally the KFC mascot. He's like a pimp in the book, but also just a concept; whatever that means. <br/><br/>My favorite characters were Nakata, Oshima, and Hoshino. They were kinda just vibing throughout the novel and were just cool people in general. The interesting thing I experienced was getting bored of Kafka's perspective and then being able to read Nakata's update in the next chapter and vice-versa. It was really refreshing and made getting through the story easier. Somehow their lives intertwine and even now I'm still trying to piece together how and why. <br/><br/>There are a lot of mysterious riddles left unsolved after finishing the book so be prepared for that feeling of confusion. The mystical realm kind of feels like an unfinished concept, but that adds to the mystery which is what I guess Murakami wanted. <br/><br/>I definitely enjoyed <i>Norwegian Wood</i> way more, but this was still a fun read. <br/><br/>@ex-wifey. If you see this I kinda wanna know what you thought of the book cuz I still don't really understand what happened. <br/>P.S. the kids miss you. come home <3<br/><br/>Overall Score: 3.5/5",,,1,0
61170765,IQ84,Haruki Murakami,"Murakami, Haruki",,"=""""","=""""",0,3.94,,Paperback,928,2009,2009,,2023/02/16,to-read,to-read (#1),to-read,,,,0,0
18144590,The Alchemist,Paulo Coelho,"Coelho, Paulo",,"=""0062315005""","=""9780062315007""",4,3.91,HarperOne,Paperback,182,2014,1988,2023/02/11,2023/02/04,,,read,"This was such a fulfilling book. <br/><br/>The character development of Santiago just overjoyed my heart. I've never seen an author write such a self-compassionate character before, and it made me reflect on myself. <br/><br/>Our main character is a young shepherd named Santiago. Santiago's been having reoccurring dreams of finding treasure near the pyramids in Egypt. The story is about his journey to find this treasure that may or may not exist and along the way, he meets many people that change his perspective, teach him new things, and help him during challenging situations. <br/><br/>I saw alot of people clownin on this story in the reviews >:(<br/>I genuinely think these haters read the book literally and were too ignorant to enjoy the casual self-reflection you achieve while reading this story. Obviously, the story is the typical ""It's about the journey, not the destination"" type of book. But if that's all you got out of it, then I can just tell you the type of person to sneeze into the open air/ keep walking while your friend is tying their shoes/ chew with your mouth open/ say the most out of pocket things at improper times. Basically, I just wouldn't want to be your friend.<br/><br/>I think reading this book helps if you believe in God, higher powers, or the mystical abilities of the universe. You kinda feel one with it all; especially at the end when Santiago does some air bending. <br/><br/>I typically don't read philosophical stories, but my boy Paulo really piqued my interest in them <br/>\(◦'⌣'◦)/<br/><br/>Maktub.<br/><br/>Overall Score: 4.6/5",,,1,0
52578297,The Midnight Library,Matt Haig,"Haig, Matt",,"=""""","=""""",2,4.01,Viking,Hardcover,304,2020,2020,2023/02/04,2023/01/27,,,read,"I didn't hate the novel, but at the same time, I didn't love it.<br/>I love chocolate chip cookies; especially when they're warm and gooey. This felt more like a room-temperature sugar cookie - not quite a chocolate chip cookie, but good enough. <br/><br/>Nora, our main character, just attempted suicide but gets stuck in a purgatorial state called the Midnight Library. She lives multiple variations of her life and learns throughout each of them. This phenomenon is explained to be a feat of quantum mechanics; having the essence of a Schrodinger's cat situation. I kind of like this interpretation of parallel universes after death, but also kind of hate it because I think it's way too oversimplified. <br/><br/>My main issue with this book is that it felt too predictable. After the explanation of the Midnight Library in the novel, I had a pretty accurate conception of how the book would end. I'm really not a fan of predictable stories but this one had some good random things sprinkled in. <br/><br/>I felt like Nora didn't struggle to overcome her depression in this novel; almost like she was guided so easily by Mrs. Elms in the library. I heard Matt Haig is known for his writing specializing in depression and mental health, so this depiction of overcoming depression was not what I quite expected. I'll probably give another one of his novels a read later on to see what he's really known for. <br/><br/>The cover art is pretty sick tho :D<br/><br/>Overall Score: 2.3/5",,,1,0
57771224,Good Intentions,Kasim Ali,"Ali, Kasim",,"=""1250809606""","=""9781250809605""",4,3.39,Henry Holt and Co.,Hardcover,288,2022,2022,2023/01/13,2023/01/08,,,read,"AHHHHH I LOVED THIS BOOK UNTIL THE LAST CHAPTER<br/><br/>This was an amazing love story that was brought to ruin because of the lack of courage and selfish acts of our main character Nur. <br/><br/>I loved all the characters in the book. Nur is the eldest son of a Pakistani Muslim household, and although I am neither Pakistani nor Muslim, I lowkey understand the pressures he goes through as the eldest son of a South Asian family. He has anxiety due to his habit of overthinking and isn't the best with his words despite graduating with an English major and aspiring to become an author.<br/><br/>Yasmina is the eldest daughter of a Sudanese Muslim household. Her family is pretty chill, but she also has her own issues regarding her younger sister. Yasmina's dialogue throughout the book made me fall in love with her personality (also because as I read the book, the image of what she looked like in my head was absolutely gorgeous). <br/><br/>They met at Nur's ex's party and they hit it off from there. Their love story felt natural and made me smile as I read the book. They were quite literally meant for each other, but Nur basically had a thought in the back of his head that told him it was never meant to be due to the color of their skin. Although I liked Nur's character, I despised him as a person for some of his reckless words and cowardly actions. ESPECIALLY WITHIN THE LAST CHAPTER.<br/><br/>The other side character progressed the story perfectly. One of my favorite aspects of the book was seeing these side-character relationships grow and diminish with Nur; specifically with Rahat and Imran.<br/><br/>This story could have ended with a perfect romantic ending - but it didn't. Maybe that's exactly the type of ending this generation of Muslims, South Asians, etc. need. I just wish Nur did more.<br/><br/>Can't wait for more work by Kasim Ali :D<br/><br/>Overall Score: 4.5/5",,,1,0
31684925,Chemistry,Weike Wang,"Wang, Weike",,"=""1524731757""","=""""",4,3.74,Knopf,Kindle Edition,224,2017,2017,,2023/01/08,,,read,"Such an amazing read - this is the fastest I have read a book!<br/><br/>As I flipped through the pages, it felt like a natural dialogue between me and a close friend going through depression. Almost as if this friend were catching me up on their life and how they are dealing with a breakup, stress, anxiety, and other variabilities of life. <br/><br/>The main character is quite relatable. Someone who excelled in her academics in the past, mainly to impress her parents, realizing she isn't as brilliant as she once thought when having to apply what she learned to her PhD thesis. Obviously, obtaining a PhD is already an insanely difficult task to achieve; doing so while having a quarter-life crisis must be unbearable. Hearing her complain about her problems in academia felt notalgic to me and made me slightly miss the suffering of undergrad. <br/><br/>I loved the snippets of science facts that were sprinkled throughout the book. Those random facts that still haunt me from my chemistry and physics classes have finally found a purpose. It made the story even more memorable to me. <br/><br/>I really hope Weike Wang makes a sequel to this story. The main character of the book doesn't have a name. I wish she did because I would like to hear from her again. <br/><br/>Overall Score: 4.8/5",,,1,0
57653407,Dava Shastri's Last Day,Kirthana Ramisetti,"Ramisetti, Kirthana",,"=""1538703866""","=""9781538703861""",4,3.50,Grand Central Publishing,Hardcover,384,2021,2021,2022/11/01,2022/10/14,,,read,"I can't even begin to describe how much I enjoyed this book. <br/><br/>I typically read novels with nihilistic themes to make myself feel better about my life (selfish I know, but it's a guilty pleasure). Usually, the main characters in these stories have terrible flaws that they don't recognize or actively fix. Dava's life, in a sense, could be considered to be the opposite of nihilism. Obviously, we could label her life down to the theme of careerism; but, I feel as if that's simplifying it too much. Her obsession to control the narrative of her life is her way of making meaning out of her life and her legacy.<br/><br/>I love Dava's character. Being Indian myself, I see my mother in Dava. A total badass, but also filled with annoying flaws that make me love her even more.  It was so interesting for me to see similar cultural, social, emotional, mental, and financial aspects of life through just one character. Honestly, this is the first contemporary novel I've read featuring an Indian main character and a multicultural family with modern-day relationships. None of those themes overbore the sense of grief throughout the novel. The family, including Dava herself, had to come to terms with her planned death; all within a short period of time.<br/><br/>Dava's secrets drive the story. Each one reveals the relationship between her and her children; not to mention how spicy each secret is. Such a strong-willed person is brought to their knees on some occasions. The ability to recognize her tragic past, and put it away to build a successful future is so heart-rending but is also so inspirational. By the end of the book, it had me questioning what I would want people to recognize me for. <br/><br/>I am definitely biased since I feel like I can relate to the main character so well, but I would go as far as to say that this is one of the most enjoyable books I've read so far in my 23 years of life :)<br/><br/>I will absolutely be reading more of Kirthana Ramisetti's work in the future!<br/><br/>Overall Score: 4.7/5",,,1,0
58470819,The Employees,Olga Ravn,"Ravn, Olga",Martin Aitken,"=""0811231356""","=""9780811231350""",3,3.70,New Directions,Hardcover,144,2022,2018,,2022/10/03,,,read,"What did I just read?<br/><br/>Confusion is probably the best emotion I could describe from my experience reading this book. <br/><br/>The composition of this book was really dope. It's structured as a semi-chronological logbook of a ship traveling through space. I say semi-chronological because it follows an interesting pattern where groups of 10s may be out of order, but the factors of 10s are in order. (You'll understand as you read through the book)<br/><br/>Here's the basic rundown. Employees on a ship traveling through space. Some are human, some are humanoids (robots with AI sentience and biological features of a human). Objects are placed in a special room of the ship and get switched out routinely. The objects have powers (maybe?). Humans and Humanoids report to a third party. Something goes wrong and a third party steps in. A weird ending happens that I don't know if I'm happy with. <br/><br/>Don't ask me what the objective of the ship and its employees were, the purpose of the objects, who the third party is, etc., because I have no idea. I wish I could tell you, but that synopsis I gave you above is the best I could do. <br/><br/>I found it funny that I related to the humanoids more and enjoyed their logs more than the humans. Their stories are just more interesting. They are told that they are updated versions of humans, but they also know that they are sentient robots. The majority of the humanoids all kind of felt the presence of emotions, or at least the thought of having emotions. The humans, all kind of seemed boring to me. They all left Earth for their own reasons, and most of the human logs described how much they missed Earth. The relationships between humans and humanoids never seemed to be overtly hostile; which I enjoyed. In fact, some of the humans and humanoids were friends that would regularly eat together in the canteen. I was relieved it did not turn into a humans-versus-humanoids war story. <br/><br/>I want to throw out a wild guess based on the title ""The Employees"" and say the story depicts our current societal views on big corporations and workplaces. <br/><br/>Maybe the ships true objective is meant to be unknown because no employee really knows what the truth behind corporations goals are or what they're doing behind closed doors. <br/>Maybe the distinction between humans and humanoids is a reference to the new and older generation of workers? or perhaps a separation of lower and higher classes?<br/>Maybe the unknown third-party makes us question who is the real head of a company? <br/>And Maybe the weird ending is supposed to signify that nothing matters anyways because big corporations don't care about your lives?<br/><br/>Lots of maybe's and so many more questions as I read this book. Definitely a book that makes you put together pieces of a puzzle and think as you read it. <br/><br/>I will definitely be reading this book again in the future to make more sense of it. I can already tell it will be just as good a second time. <br/><br/>Overall Score: 3.9/5",,,1,0
194740,The Setting Sun (New Directions Book),Osamu Dazai,"Dazai, Osamu",Donald Keene,"=""0811200329""","=""9780811200325""",4,3.99,New Directions,Paperback,175,1968,1947,,2022/10/03,,,read,"Again, another masterpiece by Dazai. <br/><br/>Although No Longer Human definitely pulled on the string of my heart, it did not generate any tears as The Setting Sun did. I could not help but feel sympathetic towards Kazuko as she went through pitiful interactions with her mother, brother, and MC. <br/><br/>Her relationship with her mother was truly inspirational, but at the same time felt so pathetic. Such selfless love for someone, only to be treated as second-class compared to her brother. I felt sorry for Kazuko because she was trapped. Having to spend so much love on someone while not being able to explore love for yourself must have been so taxing. This relationship makes you realize that love can be a double-edged sword. <br/><br/>I thought her interactions with MC were the absolute worst; mainly because I believe MC to be the human embodiment of the scum under a frat boy's fingernails. I respect Naoji for at least acknowledging that he is disgraceful and unworthy of the love of his mother and sister. MC, on the other hand, is totally delusional about the fact that he is a walking black hole that sucks the life force of humans and transforms them into lifeless stars. It felt so disheartening to see Kazuko, a character that I highly respected, become infatuated with such a terrible person. At the same time, I understood her longing for being wanted and could not blame her for falling into his trashy appeal. <br/><br/>In the end, we see such a great redemption arc from Kazuko. As the sun sets, a new day is to come. So is the same for the story of our new Kazuko. Her new life as a single mother will be difficult, but it excites me to know that the child won't be influenced by their piece of shit father :D<br/><br/>Overall Score: 4.6/5",,,1,0
194746,No Longer Human,Osamu Dazai,"Dazai, Osamu",Donald Keene,"=""""","=""""",4,4.02,New Directions,Paperback,177,1958,1948,,2022/10/03,,,read,"Truly an amazing story with one of the worst main characters I have ever had the experience of reading about. <br/><br/>This book gave me Catcher in the Rye vibes, in which I entirely adored the world-building that took place in my head as I conjured scenes from the story; however, I despised Holden Caulfield for his lack of self-respect and sense of responsibility for his actions. In the same way, I find Oba Yozo to be absolutely deplorable. I find the resolution to the story to be a total cop-out and unfair to those going through depression. I understand that Yozo has become so detached and desensitized to his surroundings due to experiences he has been through in the past - making him ""no longer human"" - but I still can't help but hate his actions and his cowardly demeanor. <br/><br/>Don't get me wrong, this story pulled at the strings of my heart at times and had me screaming silently into my book simultaneously. Dazai is obviously a master of his craft, which makes it even heavier when I consider this story to be his last memoir before his suicide. <br/><br/>This was the first piece of Dazai's work that I have read, and it will definitely not be the last!<br/><br/>Overall Score: 4.3/5",,,1,0
40517892,Artemis,Andy Weir,"Weir, Andy",,"=""0553448145""","=""9780553448146""",3,3.69,Ballantine Books,Paperback,368,2018,2017,,2022/10/03,,,read,"Honestly, a pretty typical dystopian story where the main character has to save their society from the brink of collapse. <br/><br/>Part of the reason I thought Artemis was a good read was because of how much I enjoyed the main character. She's a total badass and my imagination ran wild with the situations she was put through. <br/><br/>I obviously don't hate the story, but at the same time, I don't think it particularly has any spectacular feature that sets it apart from any other young-adult dystopian society book. <br/><br/>I will say though, that this story would have absolutely thrived in the Hunger Games, Divergent, Maze Runner era when I was in middle school.<br/><br/>Overall Score: 3.7/5",,,1,0
